{
  "catalog_id": "demo-katalog",
  "version": 1,
  "currency": "EUR",
  "country": "AT",
  "language": "de",
  "source_ref": "fiktiv; keine echten Produkte",
  "products": [
    {
      "sku": "DEMO-SHIRT-WE-M",
      "title": "Musterhof Demo-Shirt weiss M",
      "link": "https://shop.example.com/demo-shirt?farbe=weiss&groesse=M",
      "image_link": "https://shop.example.com/bilder/demo-shirt-weiss.jpg",
      "price": "29.90",
      "gtin": "2000000000015",
      "color": "weiss",
      "size": "M",
      "stock_quantity": "5",
      "description": "Fiktives Demoprodukt aus Bio-Baumwolle. Keine echten Produktdaten.",
      "brand": "Musterhof",
      "condition": "new",
      "google_product_category": "Apparel & Accessories > Clothing > Shirts & Tops",
      "product_type": "Bekleidung > Shirts",
      "item_group_id": "DEMO-SHIRT",
      "material": "Baumwolle",
      "gender": "unisex",
      "age_group": "adult",
      "availability": "in_stock"
    },
    {
      "sku": "DEMO-SHIRT-WE-L",
      "title": "Musterhof Demo-Shirt weiss L",
      "link": "https://shop.example.com/demo-shirt?farbe=weiss&groesse=L",
      "image_link": "https://shop.example.com/bilder/demo-shirt-weiss.jpg",
      "price": "29.90",
      "gtin": "2000000000022",
      "color": "weiss",
      "size": "L",
      "stock_quantity": "6",
      "description": "Fiktives Demoprodukt aus Bio-Baumwolle. Keine echten Produktdaten.",
      "brand": "Musterhof",
      "condition": "new",
      "google_product_category": "Apparel & Accessories > Clothing > Shirts & Tops",
      "product_type": "Bekleidung > Shirts",
      "item_group_id": "DEMO-SHIRT",
      "material": "Baumwolle",
      "gender": "unisex",
      "age_group": "adult",
      "availability": "in_stock"
    },
    {
      "sku": "DEMO-SHIRT-SC-M",
      "title": "Musterhof Demo-Shirt schwarz M",
      "link": "https://shop.example.com/demo-shirt?farbe=schwarz&groesse=M",
      "image_link": "https://shop.example.com/bilder/demo-shirt-schwarz.jpg",
      "price": "29.90",
      "gtin": "2000000000039",
      "color": "schwarz",
      "size": "M",
      "stock_quantity": "7",
      "description": "Fiktives Demoprodukt aus Bio-Baumwolle. Keine echten Produktdaten.",
      "brand": "Musterhof",
      "condition": "new",
      "google_product_category": "Apparel & Accessories > Clothing > Shirts & Tops",
      "product_type": "Bekleidung > Shirts",
      "item_group_id": "DEMO-SHIRT",
      "material": "Baumwolle",
      "gender": "unisex",
      "age_group": "adult",
      "availability": "in_stock",
      "sale_price": "24.90",
      "lowest_price_30d": "29.90",
      "sale_price_effective_date": "2026-11-01T00:00:00+01:00/2026-11-15T23:59:59+01:00"
    },
    {
      "sku": "DEMO-SHIRT-SC-L",
      "title": "Musterhof Demo-Shirt schwarz L",
      "link": "https://shop.example.com/demo-shirt?farbe=schwarz&groesse=L",
      "image_link": "https://shop.example.com/bilder/demo-shirt-schwarz.jpg",
      "price": "29.90",
      "gtin": "2000000000046",
      "color": "schwarz",
      "size": "L",
      "stock_quantity": "8",
      "description": "Fiktives Demoprodukt aus Bio-Baumwolle. Keine echten Produktdaten.",
      "brand": "Musterhof",
      "condition": "new",
      "google_product_category": "Apparel & Accessories > Clothing > Shirts & Tops",
      "product_type": "Bekleidung > Shirts",
      "item_group_id": "DEMO-SHIRT",
      "material": "Baumwolle",
      "gender": "unisex",
      "age_group": "adult",
      "availability": "in_stock"
    },
    {
      "sku": "DEMO-BEUTEL",
      "title": "Musterhof Demo-Stoffbeutel",
      "description": "Fiktiver Demoartikel ohne Hersteller-GTIN.",
      "link": "https://shop.example.com/demo-beutel",
      "image_link": "https://shop.example.com/bilder/demo-beutel.jpg",
      "availability": "preorder",
      "availability_date": "2026-12-01T00:00:00+01:00",
      "price": "9.90",
      "brand": "Musterhof",
      "mpn": "MH-BEUTEL-01",
      "condition": "new",
      "google_product_category": "Apparel & Accessories > Handbags, Wallets & Cases",
      "stock_quantity": "0"
    }
  ]
}
